{
  "eventId": "evt-20260510-0001",
  "tenantId": "tenant-demo",
  "partnerId": "acme-marketplace",
  "eventType": "CanonicalOrderCreated",
  "schemaVersion": "v1",
  "occurredAt": "2026-05-10T09:15:00.000Z",
  "correlationId": "corr-20260510-0001",
  "payload": {
    "orderId": "ORD-123",
    "customerName": "Ada Lovelace",
    "customerEmail": "no-reply@test.com",
    "orderDate": "2026-05-10T00:00:00.000Z",
    "status": "ACTIVE",
    "currency": "TRY",
    "lines": [
      {
        "lineId": "L1",
        "productId": "P100",
        "quantity": 2,
        "unitPrice": 100,
        "lineTotal": 200
      },
      {
        "lineId": "L2",
        "productId": "P200",
        "quantity": 1,
        "unitPrice": 50.5,
        "lineTotal": 50.5
      }
    ],
    "totalAmount": 250.5
  }
}
